{
  "format": "traveler-trip",
  "formatVersion": 1,
  "id": "weekend-denver",
  "revision": 1,
  "title": "A weekend in Denver",
  "startDate": "2026-10-10",
  "endDate": "2026-10-11",
  "stays": [
    { "id": "denver", "name": "Denver", "arrive": "2026-10-10", "depart": "2026-10-11", "timezone": "America/Denver",
      "place": { "lat": 39.7392, "lng": -104.9903 } }
  ]
}
